{
  "alert_id": "demo-001",
  "timestamp": "2026-09-30T21:00:00+05:00",
  "agent": {
    "id": "001",
    "name": "WIN-PC-01"
  },
  "rule": {
    "id": "demo-rule",
    "level": 10,
    "description": "Multiple authentication failures"
  },
  "mitre": {
    "ids": ["T1110"],
    "tactics": ["Credential Access"],
    "techniques": ["Brute Force"]
  },
  "source": {
    "ip": "192.168.1.25"
  },
  "user": "demo-user"
}
